{
  "contract_version": "sentinel-alert/1.0",
  "alert_id": "ALT-20261005-205329-000",
  "mode": "fast_screen",
  "status": "alert",
  "group_scope": "__ALL__",
  "generated_at": "2026-10-05T20:53:29.490857+00:00",
  "source": {
    "data_path": "D:\\codes\\industrial-deep-diagnostic\\workspace\\aw-exchange\\daqexp-20261006045234-ec4b43\\screen_tail400.csv",
    "sha256": "40c4c4bf69210b5b97ec444c86686e00c8fd534abd6e40b0983705df6e2b94e7",
    "window_start": null,
    "window_end": null,
    "n_rows": 400,
    "time_col": "time",
    "group_col": null
  },
  "baseline": {
    "path": "D:\\codes\\industrial-deep-diagnostic\\workspace\\closedloop\\sentinel\\baselines\\line1-extruder-206hold-20261006\\watch_baseline.json",
    "baseline_version": "v1.0.0",
    "mode": "prior",
    "generated_from": null
  },
  "checks_summary": {
    "spc": {
      "n_triggered": 9,
      "rules_hit": {}
    },
    "window_projection": {
      "n_triggered": 0
    },
    "regime": {
      "labels": {},
      "n_change_points_new": 0
    },
    "multivariate": {
      "n_outliers": 0,
      "max_d2": null
    },
    "rows_skipped": 0
  },
  "alerts": [
    {
      "alert_id": "ALT-20261005-205329-001",
      "check_type": "spc",
      "rule_name": "NELSON_R1",
      "parameter": "演示·挤出主机PLC(Modbus TCP)·熔体温度(dn-0183240d)",
      "indicator": null,
      "group": "__ALL__",
      "severity": "high",
      "urgency": "same_shift",
      "observed": {
        "value": 207.3,
        "statistic": 3.4375216194969362,
        "index": 233,
        "run_length": 1
      },
      "threshold": {
        "sigma_level": 3.0
      },
      "evidence": {
        "n_points": 1
      },
      "suggested_check": "演示·挤出主机PLC(Modbus TCP)·熔体温度(dn-0183240d) 出现超过 3σ 的单点突变，请核对传感器量程与该时刻的工况记录（快筛）",
      "suggested_next_skill": "industrial-diagnostician",
      "advisory": false,
      "suppression_key": "__ALL__|spc|NELSON_R1|演示·挤出主机PLC(Modbus TCP)·熔体温度(dn-0183240d)",
      "repeat_count": 1
    },
    {
      "alert_id": "ALT-20261005-205329-002",
      "check_type": "spc",
      "rule_name": "NELSON_R1",
      "parameter": "演示·晶点计数从站(Modbus RTU)·晶点计数(dn-a41c49cc)",
      "indicator": null,
      "group": "__ALL__",
      "severity": "high",
      "urgency": "same_shift",
      "observed": {
        "value": 9.0,
        "statistic": 3.394035883748517,
        "index": 216,
        "run_length": 1
      },
      "threshold": {
        "sigma_level": 3.0
      },
      "evidence": {
        "n_points": 1
      },
      "suggested_check": "演示·晶点计数从站(Modbus RTU)·晶点计数(dn-a41c49cc) 出现超过 3σ 的单点突变，请核对传感器量程与该时刻的工况记录（快筛）",
      "suggested_next_skill": "industrial-diagnostician",
      "advisory": false,
      "suppression_key": "__ALL__|spc|NELSON_R1|演示·晶点计数从站(Modbus RTU)·晶点计数(dn-a41c49cc)",
      "repeat_count": 1
    },
    {
      "alert_id": "ALT-20261005-205329-003",
      "check_type": "spc",
      "rule_name": "NELSON_R5",
      "parameter": "演示·挤出主机PLC(Modbus TCP)·熔体温度(dn-0183240d)",
      "indicator": null,
      "group": "__ALL__",
      "severity": "high",
      "urgency": "same_shift",
      "observed": {
        "value": 207.0,
        "statistic": 2.6433989779874727,
        "index": 120,
        "run_length": 3
      },
      "threshold": {
        "sigma_level": null
      },
      "evidence": {
        "n_points": 3
      },
      "suggested_check": "演示·挤出主机PLC(Modbus TCP)·熔体温度(dn-0183240d) 短窗口内多点超出 2σ，波动加剧，建议检查控制回路与扰动源（快筛）",
      "suggested_next_skill": "industrial-diagnostician",
      "advisory": false,
      "suppression_key": "__ALL__|spc|NELSON_R5|演示·挤出主机PLC(Modbus TCP)·熔体温度(dn-0183240d)",
      "repeat_count": 3
    },
    {
      "alert_id": "ALT-20261005-205329-004",
      "check_type": "spc",
      "rule_name": "NELSON_R5",
      "parameter": "演示·晶点计数从站(Modbus RTU)·晶点计数(dn-a41c49cc)",
      "indicator": null,
      "group": "__ALL__",
      "severity": "high",
      "urgency": "same_shift",
      "observed": {
        "value": 1.0,
        "statistic": -2.0380267497034397,
        "index": 193,
        "run_length": 3
      },
      "threshold": {
        "sigma_level": null
      },
      "evidence": {
        "n_points": 3
      },
      "suggested_check": "演示·晶点计数从站(Modbus RTU)·晶点计数(dn-a41c49cc) 短窗口内多点超出 2σ，波动加剧，建议检查控制回路与扰动源（快筛）",
      "suggested_next_skill": "industrial-diagnostician",
      "advisory": false,
      "suppression_key": "__ALL__|spc|NELSON_R5|演示·晶点计数从站(Modbus RTU)·晶点计数(dn-a41c49cc)",
      "repeat_count": 2
    },
    {
      "alert_id": "ALT-20261005-205329-005",
      "check_type": "spc",
      "rule_name": "NELSON_R6",
      "parameter": "演示·挤出主机PLC(Modbus TCP)·熔体温度(dn-0183240d)",
      "indicator": null,
      "group": "__ALL__",
      "severity": "high",
      "urgency": "same_shift",
      "observed": {
        "value": 205.6,
        "statistic": -1.0625066823898979,
        "index": 116,
        "run_length": 5
      },
      "threshold": {
        "sigma_level": null
      },
      "evidence": {
        "n_points": 5
      },
      "suggested_check": "演示·挤出主机PLC(Modbus TCP)·熔体温度(dn-0183240d) 窗口内多点超出 1σ 同侧，离散度升高，建议关注（快筛）",
      "suggested_next_skill": "industrial-diagnostician",
      "advisory": false,
      "suppression_key": "__ALL__|spc|NELSON_R6|演示·挤出主机PLC(Modbus TCP)·熔体温度(dn-0183240d)",
      "repeat_count": 2
    },
    {
      "alert_id": "ALT-20261005-205329-006",
      "check_type": "spc",
      "rule_name": "NELSON_R6",
      "parameter": "演示·挤出主机PLC(Modbus TCP)·熔体温度(dn-0183240d)",
      "indicator": null,
      "group": "__ALL__",
      "severity": "high",
      "urgency": "same_shift",
      "observed": {
        "value": 206.7,
        "statistic": 1.8492763364780094,
        "index": 244,
        "run_length": 5
      },
      "threshold": {
        "sigma_level": null
      },
      "evidence": {
        "n_points": 5
      },
      "suggested_check": "演示·挤出主机PLC(Modbus TCP)·熔体温度(dn-0183240d) 窗口内多点超出 1σ 同侧，离散度升高，建议关注（快筛）",
      "suggested_next_skill": "industrial-diagnostician",
      "advisory": false,
      "suppression_key": "__ALL__|spc|NELSON_R6|演示·挤出主机PLC(Modbus TCP)·熔体温度(dn-0183240d)",
      "repeat_count": 2
    },
    {
      "alert_id": "ALT-20261005-205329-007",
      "check_type": "spc",
      "rule_name": "NELSON_R6",
      "parameter": "演示·晶点计数从站(Modbus RTU)·晶点计数(dn-a41c49cc)",
      "indicator": null,
      "group": "__ALL__",
      "severity": "high",
      "urgency": "same_shift",
      "observed": {
        "value": 1.0,
        "statistic": -2.0380267497034397,
        "index": 193,
        "run_length": 7
      },
      "threshold": {
        "sigma_level": null
      },
      "evidence": {
        "n_points": 7
      },
      "suggested_check": "演示·晶点计数从站(Modbus RTU)·晶点计数(dn-a41c49cc) 窗口内多点超出 1σ 同侧，离散度升高，建议关注（快筛）",
      "suggested_next_skill": "industrial-diagnostician",
      "advisory": false,
      "suppression_key": "__ALL__|spc|NELSON_R6|演示·晶点计数从站(Modbus RTU)·晶点计数(dn-a41c49cc)",
      "repeat_count": 1
    },
    {
      "alert_id": "ALT-20261005-205329-008",
      "check_type": "spc",
      "rule_name": "NELSON_R2",
      "parameter": "演示·晶点计数从站(Modbus RTU)·晶点计数(dn-a41c49cc)",
      "indicator": null,
      "group": "__ALL__",
      "severity": "warn",
      "urgency": "routine",
      "observed": {
        "value": 3.0,
        "statistic": -0.6800110913404505,
        "index": 36,
        "run_length": 14
      },
      "threshold": {
        "sigma_level": null
      },
      "evidence": {
        "n_points": 14
      },
      "suggested_check": "演示·晶点计数从站(Modbus RTU)·晶点计数(dn-a41c49cc) 连续多点偏离中心线同一侧，存在均值漂移趋势，建议检查上下游工况（快筛）",
      "suggested_next_skill": "industrial-diagnostician",
      "advisory": false,
      "suppression_key": "__ALL__|spc|NELSON_R2|演示·晶点计数从站(Modbus RTU)·晶点计数(dn-a41c49cc)",
      "repeat_count": 2
    },
    {
      "alert_id": "ALT-20261005-205329-009",
      "check_type": "spc",
      "rule_name": "NELSON_R2",
      "parameter": "演示·晶点计数从站(Modbus RTU)·晶点计数(dn-a41c49cc)",
      "indicator": null,
      "group": "__ALL__",
      "severity": "warn",
      "urgency": "routine",
      "observed": {
        "value": 1.0,
        "statistic": -2.0380267497034397,
        "index": 193,
        "run_length": 10
      },
      "threshold": {
        "sigma_level": null
      },
      "evidence": {
        "n_points": 10
      },
      "suggested_check": "演示·晶点计数从站(Modbus RTU)·晶点计数(dn-a41c49cc) 连续多点偏离中心线同一侧，存在均值漂移趋势，建议检查上下游工况（快筛）",
      "suggested_next_skill": "industrial-diagnostician",
      "advisory": false,
      "suppression_key": "__ALL__|spc|NELSON_R2|演示·晶点计数从站(Modbus RTU)·晶点计数(dn-a41c49cc)",
      "repeat_count": 2
    }
  ],
  "regime_summary": null,
  "projection_summary": null,
  "suppression": {
    "applied": [
      {
        "suppression_key": "__ALL__|spc|NELSON_R2|演示·晶点计数从站(Modbus RTU)·晶点计数(dn-a41c49cc)",
        "repeat_count": 4
      },
      {
        "suppression_key": "__ALL__|spc|NELSON_R5|演示·挤出主机PLC(Modbus TCP)·熔体温度(dn-0183240d)",
        "repeat_count": 3
      },
      {
        "suppression_key": "__ALL__|spc|NELSON_R5|演示·晶点计数从站(Modbus RTU)·晶点计数(dn-a41c49cc)",
        "repeat_count": 2
      },
      {
        "suppression_key": "__ALL__|spc|NELSON_R6|演示·挤出主机PLC(Modbus TCP)·熔体温度(dn-0183240d)",
        "repeat_count": 4
      }
    ],
    "config": {
      "suppress_window_minutes": 60,
      "hysteresis_points": 5,
      "post_changepoint_quiet_rows": 30
    }
  },
  "provenance": {
    "input_sha256": "40c4c4bf69210b5b97ec444c86686e00c8fd534abd6e40b0983705df6e2b94e7",
    "script_version": "1.0.0",
    "duration_ms": 24,
    "zero_llm": true,
    "authored_by": "script"
  }
}