{
  "contract_version": "sentinel-alert/1.0",
  "alert_id": "ALT-20261006-171407-000",
  "mode": "fast_screen",
  "status": "ok",
  "group_scope": "__ALL__",
  "generated_at": "2026-10-06T17:14:07.898541+00:00",
  "source": {
    "data_path": "D:\\codes\\industrial-deep-diagnostic\\workspace\\aw-exchange\\screen_tail400_ln-d7e0a2a2_20261007T011144.csv",
    "sha256": "4e4898a0f66e76295cd6717451858bfc612c16000023de7e2671140df6c16840",
    "window_start": null,
    "window_end": null,
    "n_rows": 400,
    "time_col": null,
    "group_col": null
  },
  "baseline": {
    "path": "D:\\codes\\industrial-deep-diagnostic\\workspace\\closedloop\\sentinel\\baselines\\演示线1·挤出主机PLC(Modbus TCP)\\watch_baseline.json",
    "baseline_version": "v1.0.0",
    "mode": "prior",
    "generated_from": null
  },
  "checks_summary": {
    "spc": {
      "n_triggered": 0,
      "rules_hit": {}
    },
    "window_projection": {
      "n_triggered": 0
    },
    "regime": {
      "labels": {},
      "n_change_points_new": 0
    },
    "multivariate": {
      "n_outliers": 0,
      "max_d2": null
    },
    "rows_skipped": 0
  },
  "alerts": [],
  "regime_summary": null,
  "projection_summary": null,
  "suppression": {
    "applied": [],
    "config": {
      "suppress_window_minutes": 60,
      "hysteresis_points": 5,
      "post_changepoint_quiet_rows": 30
    }
  },
  "provenance": {
    "input_sha256": "4e4898a0f66e76295cd6717451858bfc612c16000023de7e2671140df6c16840",
    "script_version": "1.0.0",
    "duration_ms": 24,
    "zero_llm": true,
    "authored_by": "script"
  }
}