{
  "contract_version": "sentinel-alert/1.0",
  "alert_id": "ALT-20261001-135632-000",
  "mode": "watch",
  "status": "ok",
  "group_scope": null,
  "generated_at": "2026-10-01T13:56:32.735191+00:00",
  "source": {
    "data_path": "D:\\codes\\myskills\\industrial-deep-diagnostic\\.claude\\skills\\industrial-sentinel\\tests\\fixtures\\F1_watch_steady\\watch.csv",
    "sha256": "9097c9b1d89c44d5478bb460b97b657fa5a95ad91fbaf45520ddda526f52bf53",
    "window_start": null,
    "window_end": null,
    "n_rows": 240,
    "time_col": null,
    "group_col": null
  },
  "baseline": {
    "path": "D:\\codes\\myskills\\industrial-deep-diagnostic\\.claude\\skills\\industrial-sentinel\\tests\\fixtures\\F1_watch_steady\\watch_baseline.json",
    "baseline_version": "v1.0.0",
    "mode": "prior",
    "generated_from": null
  },
  "checks_summary": {
    "spc": {
      "n_triggered": 0,
      "rules_hit": {}
    },
    "window_projection": {
      "n_triggered": 0
    },
    "regime": {
      "labels": {
        "__ALL__": {
          "steady": 240
        }
      },
      "n_change_points_new": 0
    },
    "multivariate": {
      "n_outliers": 0,
      "max_d2": null
    },
    "rows_skipped": 0
  },
  "alerts": [
    {
      "alert_id": "ALT-20260101-000000-001",
      "check_type": "spc",
      "rule_name": "NELSON_R1",
      "parameter": "temp",
      "indicator": null,
      "group": "__ALL__",
      "severity": "high",
      "urgency": "same_shift",
      "observed": {
        "value": 50.5,
        "statistic": 10.2,
        "index": 100,
        "timestamp": null,
        "run_length": 1
      },
      "threshold": {
        "bound": 3.0,
        "sigma_level": 3.0
      },
      "evidence": {
        "n_points": 1
      },
      "suggested_check": "单点突变核查",
      "suggested_next_skill": "industrial-diagnostician",
      "advisory": false,
      "suppression_key": "__ALL__|spc|NELSON_R1|temp",
      "repeat_count": 1
    }
  ],
  "regime_summary": {
    "__ALL__": {
      "labels": {
        "steady": 240
      }
    }
  },
  "projection_summary": null,
  "suppression": {
    "applied": [],
    "config": {
      "suppress_window_minutes": 60,
      "hysteresis_points": 5,
      "post_changepoint_quiet_rows": 30
    }
  },
  "provenance": {
    "input_sha256": "9097c9b1d89c44d5478bb460b97b657fa5a95ad91fbaf45520ddda526f52bf53",
    "script_version": "1.0.0",
    "duration_ms": 12,
    "zero_llm": true,
    "authored_by": "script"
  }
}