{
  "contract_version": "sentinel-alert/1.0",
  "alert_id": "ALT-20261010-025201-000",
  "mode": "fast_screen",
  "status": "alert",
  "group_scope": "__ALL__",
  "generated_at": "2026-10-10T02:52:01.203744+00:00",
  "source": {
    "data_path": "D:\\codes\\industrial-deep-diagnostic\\.claude\\skills\\industrial-sentinel\\tests\\fixtures\\F3_fast_spike\\b4.csv",
    "sha256": "a90ccfccdadc7dd0b3dd02fd35a72cf73c1d6de88b589e32cc325534effb6014",
    "window_start": null,
    "window_end": null,
    "n_rows": 60,
    "time_col": null,
    "group_col": null
  },
  "baseline": {
    "path": "D:\\codes\\industrial-deep-diagnostic\\.claude\\skills\\industrial-sentinel\\tests\\fixtures\\F3_fast_spike\\watch_baseline.json",
    "baseline_version": "v1.0.0",
    "mode": "prior",
    "generated_from": null
  },
  "checks_summary": {
    "spc": {
      "n_triggered": 1,
      "rules_hit": {}
    },
    "window_projection": {
      "n_triggered": 0
    },
    "regime": {
      "labels": {},
      "n_change_points_new": 0
    },
    "multivariate": {
      "n_outliers": 1,
      "max_d2": null
    },
    "rows_skipped": 0
  },
  "alerts": [
    {
      "alert_id": "ALT-20261010-025201-001",
      "check_type": "multivariate",
      "rule_name": "ROBUST_Z_OUTLIER",
      "parameter": "temp",
      "indicator": null,
      "group": "__ALL__",
      "severity": "high",
      "urgency": "same_shift",
      "observed": {
        "value": 50.5,
        "statistic": 12.090504730056995,
        "index": 730,
        "run_length": 1
      },
      "threshold": {
        "bound": 3.5
      },
      "evidence": {
        "n_points": 1
      },
      "suggested_check": "temp 稳健 z |12.09| 超阈值（快筛），建议进入 watch 全量核查",
      "suggested_next_skill": "industrial-diagnostician",
      "advisory": false,
      "suppression_key": "__ALL__|multivariate|ROBUST_Z_OUTLIER|temp",
      "repeat_count": 3
    },
    {
      "alert_id": "ALT-20261010-025201-002",
      "check_type": "spc",
      "rule_name": "NELSON_R1",
      "parameter": "temp",
      "indicator": null,
      "group": "__ALL__",
      "severity": "warn",
      "urgency": "same_shift",
      "observed": {
        "value": 50.5,
        "statistic": 14.432665383541917,
        "index": 730,
        "run_length": 1
      },
      "threshold": {
        "sigma_level": 3.0
      },
      "evidence": {
        "n_points": 1,
        "hysteresis_downgraded": true
      },
      "suggested_check": "temp 出现超过 3σ 的单点突变，请核对传感器量程与该时刻的工况记录（快筛）",
      "suggested_next_skill": "industrial-diagnostician",
      "advisory": true,
      "suppression_key": "__ALL__|spc|NELSON_R1|temp",
      "repeat_count": 4
    }
  ],
  "regime_summary": null,
  "projection_summary": null,
  "suppression": {
    "applied": [
      {
        "suppression_key": "__ALL__|multivariate|ROBUST_Z_OUTLIER|temp",
        "repeat_count": 3
      },
      {
        "suppression_key": "__ALL__|spc|NELSON_R1|temp",
        "repeat_count": 4
      }
    ],
    "config": {
      "suppress_window_minutes": 60,
      "hysteresis_points": 5,
      "post_changepoint_quiet_rows": 30
    }
  },
  "provenance": {
    "input_sha256": "a90ccfccdadc7dd0b3dd02fd35a72cf73c1d6de88b589e32cc325534effb6014",
    "script_version": "1.0.0",
    "duration_ms": 19,
    "zero_llm": true,
    "authored_by": "script"
  }
}