{
  "contract_version": "sentinel-alert/1.0",
  "alert_id": "ALT-20261004-063623-000",
  "mode": "watch",
  "status": "alert",
  "group_scope": null,
  "generated_at": "2026-10-04T06:36:23.637062+00:00",
  "source": {
    "data_path": "D:\\codes\\industrial-deep-diagnostic\\workspace\\field-tests\\fieldtest-20261004\\cases\\T2_sentinel_stream\\window_drift.csv",
    "sha256": "8c0354046e2201dbe642acd65b3592da218de5ed0496a5e231c147e697386d4b",
    "window_start": "2026-10-02 00:00:00.000000000",
    "window_end": "2026-10-02 03:59:00.000000000",
    "n_rows": 240,
    "time_col": "timestamp",
    "group_col": null
  },
  "baseline": {
    "path": "D:\\codes\\industrial-deep-diagnostic\\workspace\\field-tests\\fieldtest-20261004\\results\\T2\\baseline\\watch_baseline.json",
    "baseline_version": "v1.0.0",
    "mode": "prior",
    "generated_from": "D:\\codes\\industrial-deep-diagnostic\\workspace\\field-tests\\fieldtest-20261004\\cases\\T2_sentinel_stream\\doe_prior"
  },
  "checks_summary": {
    "spc": {
      "n_triggered": 5,
      "rules_hit": {
        "NELSON_R1": 2,
        "NELSON_R5": 1,
        "NELSON_R6": 1,
        "NELSON_R2": 1
      }
    },
    "window_projection": {
      "n_triggered": 1
    },
    "regime": {
      "labels": {
        "__ALL__": {
          "steady": 240
        }
      },
      "n_change_points_new": 0
    },
    "multivariate": {
      "n_outliers": 5,
      "max_d2": null
    },
    "rows_skipped": 0
  },
  "alerts": [
    {
      "alert_id": "ALT-20261004-063623-001",
      "check_type": "multivariate",
      "rule_name": "ROBUST_Z_OUTLIER",
      "parameter": "speed_rpm",
      "indicator": null,
      "group": "__ALL__",
      "severity": "high",
      "urgency": "same_shift",
      "observed": {
        "value": 1252.374,
        "statistic": 3.565641611115654,
        "index": 32,
        "run_length": 1
      },
      "threshold": {
        "bound": 3.5
      },
      "evidence": {
        "n_points": 1
      },
      "suggested_check": "speed_rpm 稳健 z 分数 |3.57| 超过 3.5，疑似离群点，请核对该行原始记录",
      "suggested_next_skill": "industrial-diagnostician",
      "advisory": false,
      "suppression_key": "__ALL__|multivariate|ROBUST_Z_OUTLIER|speed_rpm",
      "repeat_count": 4
    },
    {
      "alert_id": "ALT-20261004-063623-002",
      "check_type": "multivariate",
      "rule_name": "ROBUST_Z_OUTLIER",
      "parameter": "speed_rpm",
      "indicator": null,
      "group": "__ALL__",
      "severity": "high",
      "urgency": "same_shift",
      "observed": {
        "value": 1264.813,
        "statistic": 22.24570815592454,
        "index": 238,
        "run_length": 198
      },
      "threshold": {
        "bound": 3.5
      },
      "evidence": {
        "n_points": 198
      },
      "suggested_check": "speed_rpm 稳健 z 分数 |22.25| 超过 3.5，疑似离群点，请核对该行原始记录",
      "suggested_next_skill": "industrial-diagnostician",
      "advisory": false,
      "suppression_key": "__ALL__|multivariate|ROBUST_Z_OUTLIER|speed_rpm",
      "repeat_count": 1
    },
    {
      "alert_id": "ALT-20261004-063623-003",
      "check_type": "spc",
      "rule_name": "NELSON_R1",
      "parameter": "speed_rpm",
      "indicator": null,
      "group": "__ALL__",
      "severity": "high",
      "urgency": "same_shift",
      "observed": {
        "value": 1251.6768,
        "statistic": 3.114620874628857,
        "index": 22,
        "timestamp": "row 22",
        "run_length": 1
      },
      "threshold": {
        "bound": 1.615304944811058,
        "sigma_level": 3.0
      },
      "evidence": {
        "n_points": 1
      },
      "suggested_check": "speed_rpm 出现超过 3σ 的单点突变，请核对传感器量程与该时刻的工况记录",
      "suggested_next_skill": "industrial-diagnostician",
      "advisory": false,
      "suppression_key": "__ALL__|spc|NELSON_R1|speed_rpm",
      "repeat_count": 3
    },
    {
      "alert_id": "ALT-20261004-063623-004",
      "check_type": "spc",
      "rule_name": "NELSON_R1",
      "parameter": "speed_rpm",
      "indicator": null,
      "group": "__ALL__",
      "severity": "high",
      "urgency": "same_shift",
      "observed": {
        "value": 1264.1691,
        "statistic": 26.31575086583557,
        "index": 239,
        "timestamp": "row 239",
        "run_length": 210
      },
      "threshold": {
        "bound": 1.615304944811058,
        "sigma_level": 3.0
      },
      "evidence": {
        "n_points": 210
      },
      "suggested_check": "speed_rpm 出现超过 3σ 的单点突变，请核对传感器量程与该时刻的工况记录",
      "suggested_next_skill": "industrial-diagnostician",
      "advisory": false,
      "suppression_key": "__ALL__|spc|NELSON_R1|speed_rpm",
      "repeat_count": 1
    },
    {
      "alert_id": "ALT-20261004-063623-005",
      "check_type": "spc",
      "rule_name": "NELSON_R5",
      "parameter": "speed_rpm",
      "indicator": null,
      "group": "__ALL__",
      "severity": "high",
      "urgency": "same_shift",
      "observed": {
        "value": 1264.1691,
        "statistic": 26.31575086583557,
        "index": 239,
        "timestamp": "row 239",
        "run_length": 226
      },
      "threshold": {
        "bound": 1.076869963207372,
        "sigma_level": 2.0
      },
      "evidence": {
        "n_points": 226
      },
      "suggested_check": "speed_rpm 短窗口内多点超出 2σ，波动加剧，建议检查控制回路与扰动源",
      "suggested_next_skill": "industrial-diagnostician",
      "advisory": false,
      "suppression_key": "__ALL__|spc|NELSON_R5|speed_rpm",
      "repeat_count": 1
    },
    {
      "alert_id": "ALT-20261004-063623-006",
      "check_type": "spc",
      "rule_name": "NELSON_R6",
      "parameter": "speed_rpm",
      "indicator": null,
      "group": "__ALL__",
      "severity": "high",
      "urgency": "same_shift",
      "observed": {
        "value": 1264.1691,
        "statistic": 26.31575086583557,
        "index": 239,
        "timestamp": "row 239",
        "run_length": 230
      },
      "threshold": {
        "bound": 0.538434981603686,
        "sigma_level": 1.0
      },
      "evidence": {
        "n_points": 230
      },
      "suggested_check": "speed_rpm 窗口内多点超出 1σ 同侧，离散度升高，建议关注",
      "suggested_next_skill": "industrial-diagnostician",
      "advisory": false,
      "suppression_key": "__ALL__|spc|NELSON_R6|speed_rpm",
      "repeat_count": 1
    },
    {
      "alert_id": "ALT-20261004-063623-007",
      "check_type": "window_projection",
      "rule_name": "WINDOW_DRIFT_PROJECTION",
      "parameter": "speed_rpm",
      "indicator": null,
      "group": "__ALL__",
      "severity": "high",
      "urgency": "same_shift",
      "observed": {
        "value": 1262.582035,
        "statistic": 3.605815555555561
      },
      "threshold": {
        "lsl": 1225.0,
        "usl": 1275.0,
        "hours_warn": 24.0,
        "hours_alarm": 8.0
      },
      "evidence": {
        "n_points": 240,
        "slope_per_hour": 3.605815555555561,
        "hours_to_edge": 3.4438713818479867,
        "direction": "up"
      },
      "suggested_check": "speed_rpm 按当前漂移速率预计 3.4 小时后触及窗口边界 [1225.0, 1275.0]，请提前安排核查",
      "suggested_next_skill": "industrial-doe-analyzer",
      "advisory": false,
      "suppression_key": "__ALL__|window_projection|WINDOW_DRIFT_PROJECTION|speed_rpm",
      "repeat_count": 1
    },
    {
      "alert_id": "ALT-20261004-063623-008",
      "check_type": "regime",
      "rule_name": "VARIANCE_RATIO_HIGH",
      "parameter": "speed_rpm",
      "indicator": null,
      "group": "__ALL__",
      "severity": "warn",
      "urgency": "routine",
      "observed": {
        "value": 4.184439616501828,
        "statistic": 11.937059951249898
      },
      "threshold": {
        "bound": 2.0
      },
      "evidence": {
        "ratio": 11.937059951249898
      },
      "suggested_check": "speed_rpm 稳态段标准差为基线的 11.9 倍，离散度显著升高，建议检查波动来源",
      "suggested_next_skill": "industrial-diagnostician",
      "advisory": false,
      "suppression_key": "__ALL__|regime|VARIANCE_RATIO_HIGH|speed_rpm",
      "repeat_count": 1
    },
    {
      "alert_id": "ALT-20261004-063623-009",
      "check_type": "spc",
      "rule_name": "NELSON_R2",
      "parameter": "speed_rpm",
      "indicator": null,
      "group": "__ALL__",
      "severity": "warn",
      "urgency": "routine",
      "observed": {
        "value": 1251.1157,
        "statistic": 2.0725266215238585,
        "index": 14,
        "timestamp": "row 14",
        "run_length": 234
      },
      "threshold": {
        "bound": null,
        "sigma_level": null
      },
      "evidence": {
        "n_points": 234
      },
      "suggested_check": "speed_rpm 连续多点偏离中心线同一侧，存在均值漂移趋势，建议检查上下游工况",
      "suggested_next_skill": "industrial-diagnostician",
      "advisory": false,
      "suppression_key": "__ALL__|spc|NELSON_R2|speed_rpm",
      "repeat_count": 1
    }
  ],
  "regime_summary": {
    "__ALL__": {
      "labels": {
        "steady": 240
      }
    }
  },
  "projection_summary": [
    {
      "factor": "speed_rpm",
      "current": 1262.582035,
      "window": [
        1225.0,
        1275.0
      ],
      "slope_per_hour": 3.605815555555561,
      "hours_to_edge": 3.4438713818479867,
      "level": "high"
    }
  ],
  "suppression": {
    "applied": [
      {
        "suppression_key": "__ALL__|multivariate|ROBUST_Z_OUTLIER|speed_rpm",
        "repeat_count": 5
      },
      {
        "suppression_key": "__ALL__|spc|NELSON_R1|speed_rpm",
        "repeat_count": 4
      }
    ],
    "config": {
      "suppress_window_minutes": 60,
      "hysteresis_points": 5,
      "post_changepoint_quiet_rows": 30
    }
  },
  "provenance": {
    "input_sha256": "8c0354046e2201dbe642acd65b3592da218de5ed0496a5e231c147e697386d4b",
    "script_version": "1.0.0",
    "duration_ms": 15,
    "zero_llm": true,
    "authored_by": "script"
  }
}